{
  "schemaVersion": 1,
  "logicalProjectId": "12345678-1234-5678-1234-567812345678",
  "project": {
    "name": "firmware",
    "origin": "manual"
  },
  "target": {
    "device": "STM32F429ZGTx",
    "core": "cortex-m4"
  },
  "framework": {
    "type": "spl",
    "version": null
  },
  "build": {
    "sources": ["App/main.c"],
    "includePaths": [],
    "defines": [],
    "compileOptions": [],
    "assemblySources": [],
    "elf": "build-fw/firmware.elf"
  },
  "debug": {
    "backend": "pyocd",
    "target": "stm32f429zgtx",
    "svd": null
  }
}
